<?xml version="1.0" encoding="UTF-8"?>
<!DOCTYPE GranuleMetaDataFile SYSTEM "http://ecsinfo.gsfc.nasa.gov/ECSInfo/ecsmetadata/dtds/DPL/ECS/ScienceGranuleMetadata.dtd">
<GranuleMetaDataFile>
    <DTDVersion>1.0</DTDVersion>
    <DataCenterId>EDC</DataCenterId>
    <GranuleURMetaData>
        <GranuleUR>SC:SRTMGL1.003:2136265234</GranuleUR>
        <DbID>2136265234</DbID>
        <InsertTime>2014-11-20 12:33:18.133</InsertTime>
        <LastUpdate>2014-11-20 12:33:18.133</LastUpdate>
        <CollectionMetaData>
            <ShortName>SRTMGL1</ShortName>
            <VersionID>3</VersionID>
        </CollectionMetaData>
        <DataFiles>
            <DataFileContainer>
                <DistributedFileName>N42W006.SRTMGL1.hgt.zip</DistributedFileName>
                <FileSize>8782090</FileSize>
                <ChecksumType>CKSUM</ChecksumType>
                <Checksum>2822462807</Checksum>
                <ChecksumOrigin>DPLIngst</ChecksumOrigin>
            </DataFileContainer>
        </DataFiles>
        <ECSDataGranule>
            <SizeMBECSDataGranule>8.37525</SizeMBECSDataGranule>
            <LocalGranuleID>N42W006.SRTMGL1.hgt.zip</LocalGranuleID>
            <ProductionDateTime>2014-11-18 17:05:10</ProductionDateTime>
            <LocalVersionID>3</LocalVersionID>
        </ECSDataGranule>
        <RangeDateTime>
            <RangeEndingTime>23:59:59.000000</RangeEndingTime>
            <RangeEndingDate>2000-02-21</RangeEndingDate>
            <RangeBeginningTime>00:00:00.000000</RangeBeginningTime>
            <RangeBeginningDate>2000-02-11</RangeBeginningDate>
        </RangeDateTime>
        <SpatialDomainContainer>
            <HorizontalSpatialDomainContainer>
                <BoundingRectangle>
                    <WestBoundingCoordinate>-6.00027778</WestBoundingCoordinate>
                    <NorthBoundingCoordinate>43.00027778</NorthBoundingCoordinate>
                    <EastBoundingCoordinate>-4.99972222</EastBoundingCoordinate>
                    <SouthBoundingCoordinate>41.99972222</SouthBoundingCoordinate>
                </BoundingRectangle>
            </HorizontalSpatialDomainContainer>
        </SpatialDomainContainer>
        <PSAs>
            <PSA>
                <PSAName>identifier_product_doi_authority</PSAName>
                <PSAValue>http://dx.doi.org</PSAValue>
            </PSA>
            <PSA>
                <PSAName>identifier_product_doi</PSAName>
                <PSAValue>10.5067/MEaSUREs/SRTM/SRTMGL1.003</PSAValue>
            </PSA>
        </PSAs>
        <BrowseProduct>
            <BrowseGranuleId>UR:10:DsShESDTUR:UR:15:DsShSciServerUR:13:[EDC:DSSDSRV]:24:BR:Browse.001:2136265250</BrowseGranuleId>
        </BrowseProduct>
        <QAProduct>
            <QAGranuleId>UR:10:DsShESDTUR:UR:15:DsShSciServerUR:13:[EDC:DSSDSRV]:20:QA:QA.001:2139635385</QAGranuleId>
        </QAProduct>
    </GranuleURMetaData>
</GranuleMetaDataFile>



